{"diagram_type": "workflow", "edges": [{"from": "sense_watch", "role": "main", "to": "sense_ntfy", "variant": "default"}, {"from": "sense_ntfy", "role": "main", "to": "decide_hyst", "variant": "default"}, {"from": "decide_hyst", "role": "main", "to": "local_engine", "variant": "emphasis"}, {"from": "decide_hyst", "role": "branch", "to": "quality_gate", "variant": "default"}, {"from": "quality_gate", "role": "branch", "to": "cond_close", "variant": "default"}, {"from": "local_engine", "label": "failover if local down", "role": "branch", "to": "cloud_engine", "variant": "dashed"}, {"from": "local_engine", "role": "main", "to": "cond_close", "variant": "emphasis"}, {"from": "cloud_engine", "role": "branch", "to": "cost_gate", "variant": "default"}, {"from": "cost_gate", "role": "branch", "to": "cloud_watch", "variant": "default"}, {"from": "cond_close", "label": "lock retry backoff", "labelDx": 48, "labelDy": 53, "role": "main", "to": "gate_log", "variant": "emphasis"}, {"from": "gate_log", "role": "main", "to": "act_remedy", "variant": "emphasis"}, {"from": "gate_log", "label": "cond-close", "labelDx": 30, "role": "branch", "to": "verify_proof", "variant": "security"}, {"from": "gate_log", "role": "branch", "to": "seq_p1p4", "variant": "default"}, {"from": "seq_p1p4", "label": "P4 done", "role": "branch", "to": "report_ntfy", "variant": "default"}, {"from": "reboot_523", "label": "5:23 precedent", "role": "branch", "to": "local_engine", "variant": "default"}, {"from": "act_remedy", "label": "claimed + logged", "role": "main", "to": "verify_proof", "variant": "emphasis"}, {"from": "verify_proof", "label": "proof in 15 min or page", "role": "main", "to": "report_ntfy", "variant": "emphasis"}, {"from": "cost_gate", "label": "within $1", "labelDx": -40, "role": "branch", "to": "gate_log", "variant": "emphasis"}], "lanes": [{"id": "sense", "label": "Sense"}, {"id": "decide", "label": "Decide"}, {"id": "local", "label": "Local Engine"}, {"id": "cloud", "label": "Cloud Engine"}, {"id": "act", "label": "Act"}, {"id": "verify", "label": "Verify"}, {"id": "seq", "label": "P1-P4 Sequence"}, {"id": "report", "label": "Report"}], "mainPath": ["sense_watch", "sense_ntfy", "decide_hyst", "local_engine", "cond_close", "gate_log", "act_remedy", "verify_proof", "report_ntfy"], "meta": {"quality_profile": "standard", "title": "Watchdog local-cloud flow \u2014 sense to report (OSM-CONS-068)", "views": [{"focus": ["sense_watch", "sense_ntfy", "decide_hyst", "quality_gate", "local_engine", "cond_close", "gate_log", "seq_p1p4", "act_remedy", "verify_proof", "report_ntfy"], "id": "happy-path", "label": "Local remediation path", "note": "Sense to report through the local 8192 NBG engine, quality-gated, enacting the P1-P4 chain."}, {"focus": ["decide_hyst", "quality_gate", "local_engine", "cloud_engine", "cost_gate", "cloud_watch", "reboot_523", "cond_close"], "id": "engine-failover", "label": "Failover and gates", "note": "Cloud failover, $1 cost gate, live cloud watch, cond-close lock retry, reboot precedent."}]}, "nodes": [{"col": 0, "id": "sense_watch", "label": "Watch loop", "lane": "sense", "sublabel": "watch_loop.py 15-min", "type": "backend"}, {"col": 0, "id": "reboot_523", "label": "5:23AM reboot", "lane": "decide", "sublabel": "precedent path, re-arm", "type": "external"}, {"col": 1, "id": "sense_ntfy", "label": "ntfy + health", "lane": "sense", "sublabel": "30-min + VerifyHealth", "type": "messagebus", "width": 100}, {"col": 1, "id": "decide_hyst", "label": "Hysteresis", "lane": "decide", "sublabel": "2 consecutive, windowed", "type": "security", "width": 100}, {"col": 1, "id": "local_engine", "label": "Local NBG 8k", "lane": "local", "sublabel": "8192, 8093, BootResume", "type": "backend", "width": 100}, {"col": 1, "id": "cloud_engine", "label": "Cloud APIs", "lane": "cloud", "sublabel": "paid mimo/muse-spark", "type": "cloud"}, {"col": 3, "id": "quality_gate", "label": "Quality gate", "lane": "decide", "sublabel": "mean<0.4, fail-streak page", "type": "security", "width": 110}, {"col": 3, "id": "cond_close", "label": "Cond-close", "lane": "local", "sublabel": "RAM<2GB, budget 2/day", "type": "security"}, {"col": 3, "id": "cost_gate", "label": "$1 cost gate", "lane": "cloud", "sublabel": "usage_ledger, failover", "type": "database"}, {"col": 4, "id": "gate_log", "label": "Log decision", "lane": "act", "sublabel": "claim + budget", "type": "database"}, {"col": 4, "id": "seq_p1p4", "label": "P1-P4 chain", "lane": "seq", "sublabel": "sessions-docs newest-first", "type": "backend", "width": 120}, {"col": 5, "id": "cloud_watch", "label": "Cloud watch", "lane": "cloud", "sublabel": "success, latency, spend", "type": "cloud", "width": 100}, {"col": 5, "id": "act_remedy", "label": "Remediate 1x", "lane": "act", "sublabel": "claimed + logged", "type": "backend"}, {"col": 5, "id": "verify_proof", "label": "Proof or page", "lane": "verify", "sublabel": "flow proof, 15 min", "type": "security"}, {"col": 5, "id": "report_ntfy", "label": "ntfy + report", "lane": "report", "sublabel": "docs/report", "type": "messagebus"}], "schema_version": 1}