{"diagram_type":"workflow","edges":[{"from":"yalo","id":"yalo-variant","to":"variant"},{"from":"variant","id":"variant-test","to":"disktest"},{"from":"disktest","id":"test-score","label":"score X/17","to":"score"},{"from":"score","id":"score-keep","label":"yes","to":"keep"},{"from":"score","id":"score-discard","label":"no","role":"branch","to":"discard"},{"from":"keep","id":"keep-gate","to":"gate"},{"from":"discard","id":"discard-gate","to":"gate"},{"from":"gate","id":"gate-again","label":"yes — loop","role":"return","to":"again","fromSide":"bottom","toSide":"right"},{"from":"again","id":"again-variant","role":"return","to":"variant","fromSide":"top","toSide":"bottom"},{"from":"gate","id":"gate-stop","label":"no — stop","to":"report"}],"lanes":[{"id":"cmdr","label":"Command"},{"id":"trial","label":"Trial Loop"},{"id":"scoring","label":"Scoring"},{"id":"control","label":"Loop Control"},{"id":"reloop","label":"Loop Return","variant":"exception"}],"mainPath":["yalo","variant","disktest","score","keep","gate","report"],"meta":{"quality_profile":"showcase","title":"Closed Loop - Pilot"},"nodes":[{"col":0,"id":"yalo","label":"One Yalo","lane":"cmdr","type":"external"},{"col":0,"id":"variant","label":"Variant","lane":"trial","type":"backend"},{"col":2,"id":"disktest","label":"Disk Test","lane":"trial","type":"messagebus","width":120},{"col":2,"id":"score","label":"Beat Best?","lane":"scoring","type":"security"},{"col":4,"id":"keep","label":"Keep Best","lane":"scoring","type":"backend"},{"col":1,"id":"discard","label":"Discard","lane":"control","type":"security"},{"col":5,"id":"gate","label":"Loop Again?","lane":"control","type":"security"},{"col":0,"id":"again","label":"Next loop","lane":"reloop","type":"messagebus"},{"col":5,"id":"report","label":"Report Best","lane":"cmdr","type":"frontend"}],"phases":[{"fromCol":0,"id":"brief","label":"Brief","toCol":1},{"fromCol":2,"id":"run","label":"Run + score","toCol":2},{"fromCol":4,"id":"decide","label":"Decide + report","toCol":5}],"schema_version":1,"cards":[{"dot":"cyan","title":"Pilot brief","items":["Metric X/17 pass-rate","Budget 2-3 hrs","Scope 1 prompt file"]}]}