{"cards":[{"dot":"amber","items":["No cap on rounds or slices","No number that ends the loop","STOP is drawn but never reached"],"title":"No Stopping Rule"},{"dot":"rose","items":["No independent check a round was worth running","Defects only feed the next round","Good enough is the agent's own call"],"title":"No Worth Check"}],"diagram_type":"workflow","edges":[{"from":"roundDoc","id":"read-doc","to":"buildSlice","variant":"emphasis"},{"from":"buildSlice","id":"build-compare","to":"compareSrc","variant":"emphasis"},{"from":"compareSrc","id":"compare-gate","to":"defectGate","variant":"default"},{"from":"defectGate","id":"defect-yes","label":"yes","to":"fixNote","variant":"security"},{"from":"defectGate","id":"defect-no","label":"no","to":"decideGate","variant":"default"},{"from":"fixNote","id":"fix-next-doc","to":"nextDoc","variant":"dashed"},{"from":"decideGate","id":"next-slice","label":"next slice","to":"nextDoc","variant":"emphasis","labelDy":50},{"from":"decideGate","id":"good-enough","label":"good enough","role":"branch","to":"stopNode","variant":"dashed"},{"from":"nextDoc","id":"round-loop","label":"Round N+1","role":"return","to":"roundDoc","variant":"emphasis"}],"lanes":[{"id":"docs","label":"Research Docs"},{"id":"build","label":"Build"},{"id":"check","label":"Compare"},{"id":"gateA","label":"Defect Gate"},{"id":"gateB","label":"Outcome Gate"},{"id":"end","label":"End"}],"mainPath":["roundDoc","buildSlice","compareSrc","defectGate","fixNote","nextDoc"],"meta":{"quality_profile":"showcase","title":"Open Loop (Archify pattern)"},"nodes":[{"col":0,"id":"roundDoc","label":"Round N","lane":"docs","type":"database"},{"col":1,"id":"buildSlice","label":"Build slice","lane":"build","type":"backend"},{"col":2,"id":"compareSrc","label":"Compare source","lane":"check","type":"frontend"},{"col":3,"id":"defectGate","label":"Defect found?","lane":"gateA","type":"security"},{"col":4,"id":"fixNote","label":"Note fix","lane":"build","type":"messagebus"},{"col":4,"id":"decideGate","label":"Good enough?","lane":"gateB","type":"security"},{"col":5,"id":"nextDoc","label":"Round N+1","lane":"check","type":"database"},{"col":5,"id":"stopNode","label":"STOP","lane":"end","type":"external"}],"schema_version":1}