{"cards":[{"dot":"cyan","items":["Phase 0 closes open items: grade the pending skill-eval, build the staleness hook","Phase 1 runs Pilot on one narrow metric: round-table climbing/flat is real data","Gate: data says worth it? yes scales, no parks - stop, do not scale","Phase 2 wires Graphify as the check substrate: god-node / orphan-skill via live MCP","Non-self-report rule: checks read live state, never self-reported claims","Phase 3 scores mini-PKM vs Graphify retrieval eval - currently unrun","Phase 4 describes the whole thing as OSM AiOS: write the story last, once true"],"title":"Closed loop, end to end"}],"diagram_type":"workflow","edges":[{"from":"grade_eval","id":"e_close","role":"main","to":"stale_hook","variant":"default"},{"from":"stale_hook","id":"e_to_pilot","role":"main","to":"pilot_run","variant":"default"},{"from":"pilot_run","id":"e_pilot_gate","role":"main","to":"worth_gate","variant":"default"},{"from":"worth_gate","id":"e_yes","role":"main","to":"graphify_wire","variant":"emphasis"},{"from":"graphify_wire","id":"e_wire_rule","role":"main","to":"nonself_rule","variant":"default"},{"from":"nonself_rule","id":"e_rule_eval","role":"main","to":"retrieval_eval","variant":"default"},{"from":"retrieval_eval","id":"e_scored","role":"main","to":"aios_story","variant":"default"},{"id":"e_no","from":"worth_gate","to":"parked","role":"branch","variant":"dashed"}],"lanes":[{"id":"close","label":"Phase 0 Close"},{"id":"pilot","label":"Phase 1 Pilot"},{"id":"gate","label":"Gate"},{"id":"substrate","label":"Phase 2 Substrate"},{"id":"retrieval","label":"Phase 3 Retrieval"},{"id":"story","label":"Phase 4 Story"}],"mainPath":["grade_eval","stale_hook","pilot_run","worth_gate","graphify_wire","nonself_rule","retrieval_eval","aios_story"],"meta":{"quality_profile":"showcase","title":"Closed Loop - Full"},"nodes":[{"id":"grade_eval","lane":"close","col":0,"label":"Grade","type":"backend"},{"id":"stale_hook","lane":"close","col":2,"label":"Stale hook","type":"messagebus"},{"id":"pilot_run","lane":"pilot","col":2,"label":"Pilot run","type":"frontend"},{"id":"worth_gate","lane":"gate","col":2,"label":"Worth it?","type":"security","tag":"gate"},{"id":"parked","lane":"gate","col":4,"label":"Parked","type":"external"},{"id":"graphify_wire","lane":"substrate","col":2,"label":"Graphify","type":"database"},{"id":"nonself_rule","lane":"substrate","col":4,"label":"Live check","type":"security"},{"id":"retrieval_eval","lane":"retrieval","col":4,"label":"PKM check","type":"cloud"},{"id":"aios_story","lane":"story","col":4,"label":"AiOS story","type":"backend"}],"schema_version":1}